{
  "$schema": "./business-information-model.concept-domain.schema.json",
  "name": "insignia_business_information_model_concept_domain",
  "description": "Flattened Data Concept to Data Domain mapping for ERD/viewpoint generation.",
  "source_model": "c:\\workspace\\datahost\\examples\\insignia\\bim\\business-information-model.json",
  "generated_at_utc": "2026-03-25T20:34:04+00:00",
  "stats": {
    "concept_domain_links": 79,
    "domain_count": 13
  },
  "links": [
    {
      "concept_name": "Advice Audit Information",
      "domain_name": "Advice",
      "concept_description": "Audit conducted by Insignia as AFSL holder",
      "information_confidentiality_classification": "Confidential",
      "grouped_by_concept_name": "",
      "groups_concept_name": ""
    },
    {
      "concept_name": "Advice Investment Committee",
      "domain_name": "Advice",
      "concept_description": "Review and approve product listing",
      "information_confidentiality_classification": "Internal",
      "grouped_by_concept_name": "",
      "groups_concept_name": ""
    },
    {
      "concept_name": "Adviser",
      "domain_name": "Advice",
      "concept_description": "Individual qualified and authorised to dispense financial advice under Australian Financial Services License rules and regulations",
      "information_confidentiality_classification": "Highly Confidential",
      "grouped_by_concept_name": "",
      "groups_concept_name": "Financial Advisers Register"
    },
    {
      "concept_name": "Fact Finding",
      "domain_name": "Advice",
      "concept_description": "Collection of financial information of client to guide and support advice to be provided.",
      "information_confidentiality_classification": "Confidential",
      "grouped_by_concept_name": "",
      "groups_concept_name": "Personal Financial Position"
    },
    {
      "concept_name": "Fee Structure",
      "domain_name": "Advice",
      "concept_description": "Disclosure of fee structure for financial advice and actioning plan",
      "information_confidentiality_classification": "Confidential",
      "grouped_by_concept_name": "",
      "groups_concept_name": ""
    },
    {
      "concept_name": "File Notes",
      "domain_name": "Advice",
      "concept_description": "Captures the key information discussed during an interaction with customer",
      "information_confidentiality_classification": "Highly Confidential",
      "grouped_by_concept_name": "",
      "groups_concept_name": ""
    },
    {
      "concept_name": "Letter of Engagement",
      "domain_name": "Advice",
      "concept_description": "Acknowledgement from client to proceed with advice, includes fees for advice",
      "information_confidentiality_classification": "Confidential",
      "grouped_by_concept_name": "",
      "groups_concept_name": ""
    },
    {
      "concept_name": "Nature of Advice",
      "domain_name": "Advice",
      "concept_description": "General in nature, Scaled (simple advisor guided or calculator, for single fund), Comprehensive (full financial circumstance considered)",
      "information_confidentiality_classification": "Confidential",
      "grouped_by_concept_name": "",
      "groups_concept_name": ""
    },
    {
      "concept_name": "Product Research",
      "domain_name": "Advice",
      "concept_description": "Product details of performance, construct and fees across various financial providers for the advice being put forward",
      "information_confidentiality_classification": "Internal",
      "grouped_by_concept_name": "",
      "groups_concept_name": "Product Comparison"
    },
    {
      "concept_name": "Prospective Customer",
      "domain_name": "Advice",
      "concept_description": "Relationship between Advisor and Prospective Client where no statement of advice has been signed",
      "information_confidentiality_classification": "Internal",
      "grouped_by_concept_name": "",
      "groups_concept_name": ""
    },
    {
      "concept_name": "Statement of Advice",
      "domain_name": "Advice",
      "concept_description": "Statement of Advice is information of financial plan put forward by advisor to client based on products and fact finding details. Including risks, strategies and financial circumstance.",
      "information_confidentiality_classification": "Highly Confidential",
      "grouped_by_concept_name": "",
      "groups_concept_name": "Record of Advice Amendment"
    },
    {
      "concept_name": "Company Board",
      "domain_name": "Corporate Governance",
      "concept_description": "Company board information to support and guide governance of organisation",
      "information_confidentiality_classification": "Confidential",
      "grouped_by_concept_name": "",
      "groups_concept_name": "Board Meeting Minutes"
    },
    {
      "concept_name": "Company Group",
      "domain_name": "Corporate Governance",
      "concept_description": "Insignia stock exchange listing information",
      "information_confidentiality_classification": "Confidential",
      "grouped_by_concept_name": "",
      "groups_concept_name": "Share Listing"
    },
    {
      "concept_name": "Corporate Policies and Standards",
      "domain_name": "Corporate Governance",
      "concept_description": "The guiding principles and rules to adhere to across key responsibility areas at Insignia. Policy documents for areas such as risk, data, diversity and inclusion, responsible investment",
      "information_confidentiality_classification": "Internal",
      "grouped_by_concept_name": "",
      "groups_concept_name": ""
    },
    {
      "concept_name": "Member / Investor Representation",
      "domain_name": "Corporate Governance",
      "concept_description": "Details to provide board with oversight of member/investors focused outcomes. Member Office and Office of Responsible Entity ensure interests of members/investors are adhered to with regards to trusts.",
      "information_confidentiality_classification": "Highly Confidential",
      "grouped_by_concept_name": "",
      "groups_concept_name": "Business Performance Review"
    },
    {
      "concept_name": "Responsible Entity",
      "domain_name": "Corporate Governance",
      "concept_description": "Information concept that covers all the governance and finance concepts in the BIM for IFL, which are replicated at the trust level, which may have different information ownership",
      "information_confidentiality_classification": "Highly Confidential",
      "grouped_by_concept_name": "",
      "groups_concept_name": ""
    },
    {
      "concept_name": "Trust",
      "domain_name": "Corporate Governance",
      "concept_description": "Information concept that covers all the governance and finance concepts in the BIM for IFL, which are replicated at the trust level, which may have different information ownership",
      "information_confidentiality_classification": "Highly Confidential",
      "grouped_by_concept_name": "",
      "groups_concept_name": ""
    },
    {
      "concept_name": "Advice Complaint",
      "domain_name": "Enquiries and Complaints",
      "concept_description": "Insignia investigation into advice provided to client by advisor, evidence and findings",
      "information_confidentiality_classification": "Highly Confidential",
      "grouped_by_concept_name": "",
      "groups_concept_name": "Advice Complaint Investigation"
    },
    {
      "concept_name": "Demand",
      "domain_name": "Enquiries and Complaints",
      "concept_description": "Customer or Advisor initiated interaction with Insignia Financial re financial account",
      "information_confidentiality_classification": "Highly Confidential",
      "grouped_by_concept_name": "",
      "groups_concept_name": "Demand Resolution"
    },
    {
      "concept_name": "Demand Analytics",
      "domain_name": "Enquiries and Complaints",
      "concept_description": "Metrics to track and measure the processing effectiveness and efficiency of demands",
      "information_confidentiality_classification": "Confidential",
      "grouped_by_concept_name": "",
      "groups_concept_name": ""
    },
    {
      "concept_name": "Identified Systemic Issue",
      "domain_name": "Enquiries and Complaints",
      "concept_description": "From analysis of complaints to identify the scale and volume of complaint or issue identified. Prepare plan for remediation.",
      "information_confidentiality_classification": "Confidential",
      "grouped_by_concept_name": "",
      "groups_concept_name": "Systemic Issue Committee Submission"
    },
    {
      "concept_name": "Internally-identified customer issue",
      "domain_name": "Enquiries and Complaints",
      "concept_description": "Issues affecting customer that likely require action by IFL to remediate, but which have not been raised directly by customer themselves. These issues may affect a cohort of customer, and information includes the list of customers affected, the nature of the issue, and possibly details of actions to remediate.",
      "information_confidentiality_classification": "Confidential",
      "grouped_by_concept_name": "",
      "groups_concept_name": ""
    },
    {
      "concept_name": "Service Survey",
      "domain_name": "Enquiries and Complaints",
      "concept_description": "Party assessment of demand service based on survey questions, Net Promoter Score, Etc",
      "information_confidentiality_classification": "Confidential",
      "grouped_by_concept_name": "",
      "groups_concept_name": ""
    },
    {
      "concept_name": "Budget",
      "domain_name": "Finance",